{
  "schema_version": "digitalocean_endpoint_freeze_v2",
  "fetched_at_utc": "2026-08-21T22:16:26.4489209Z",
  "source_url": "https://inference.do-ai.run/v1/models",
  "source_sha256": "9df592d44178e85b056a5d308556a650c81d472aee7fe617abcb402e3a8867dc",
  "api_version": "v1",
  "server_region": null,
  "server_region_note": "The public endpoint and response did not expose a serving region; client region is recorded per request.",
  "documentation_sources": {
    "models": {
      "url": "https://docs.digitalocean.com/products/inference/details/models/",
      "retrieved_at_utc": "2026-08-21T22:17:09Z",
      "sha256": "18f95e6548e405c941eea114dd100177e2c51804367efb304db4316c95520651"
    },
    "pricing": {
      "url": "https://docs.digitalocean.com/products/inference/details/pricing/",
      "retrieved_at_utc": "2026-08-21T22:17:09Z",
      "sha256": "0a2517207ba51af49b2e4a3cc3709f9df3a3dab94fcad82fed2b9fe6e56c7b16"
    },
    "limits": {
      "url": "https://docs.digitalocean.com/products/inference/details/limits/",
      "retrieved_at_utc": "2026-08-21T22:17:09Z",
      "sha256": "860d4b6e53518788171e67f4a6b47ee51ba69fc6917abb71044ae7fde4b2a789"
    },
    "api": {
      "url": "https://docs.digitalocean.com/reference/api/reference/serverless-inference/",
      "retrieved_at_utc": "2026-08-21T22:17:09Z",
      "sha256": "c8e815504e4e83be7a659964e704f18f51a44d10234f548a4a557c0315288cf6",
      "generated_date": "2026-08-20"
    },
    "support_policy": {
      "url": "https://docs.digitalocean.com/products/inference/details/model-support-policy/",
      "retrieved_at_utc": "2026-08-21T22:17:09Z",
      "sha256": "e28d1c9499316ae20583d4f42a7c9d0625f3b04f882382201924aa4eca487c03"
    }
  },
  "endpoints": [
    {
      "model_id": "all-mini-lm-l6-v2",
      "owned_by": "digitalocean",
      "api_surface": "embeddings",
      "catalog_created_unix": 1727124486,
      "catalog_context_window": null,
      "catalog_max_output_tokens": null,
      "input_usd_per_million": null,
      "output_usd_per_million": null,
      "context_window": null,
      "max_output_tokens": null,
      "provider": null,
      "documented_capabilities": null
    },
    {
      "model_id": "anthropic-claude-4.5-sonnet",
      "owned_by": "anthropic",
      "api_surface": "chat_completions",
      "catalog_created_unix": 1762371241,
      "catalog_context_window": null,
      "catalog_max_output_tokens": null,
      "input_usd_per_million": null,
      "output_usd_per_million": null,
      "context_window": null,
      "max_output_tokens": null,
      "provider": null,
      "documented_capabilities": null
    },
    {
      "model_id": "anthropic-claude-4.6-sonnet",
      "owned_by": "anthropic",
      "api_surface": "chat_completions",
      "catalog_created_unix": 1771366786,
      "catalog_context_window": null,
      "catalog_max_output_tokens": 8192,
      "input_usd_per_million": null,
      "output_usd_per_million": null,
      "context_window": null,
      "max_output_tokens": null,
      "provider": null,
      "documented_capabilities": null
    },
    {
      "model_id": "anthropic-claude-5-sonnet",
      "owned_by": "anthropic",
      "api_surface": "chat_completions",
      "catalog_created_unix": 1782856178,
      "catalog_context_window": null,
      "catalog_max_output_tokens": 128000,
      "input_usd_per_million": null,
      "output_usd_per_million": null,
      "context_window": null,
      "max_output_tokens": null,
      "provider": null,
      "documented_capabilities": null
    },
    {
      "model_id": "anthropic-claude-fable-5",
      "owned_by": "anthropic",
      "api_surface": "chat_completions",
      "catalog_created_unix": 1781035402,
      "catalog_context_window": null,
      "catalog_max_output_tokens": 128000,
      "input_usd_per_million": null,
      "output_usd_per_million": null,
      "context_window": null,
      "max_output_tokens": null,
      "provider": null,
      "documented_capabilities": null
    },
    {
      "model_id": "anthropic-claude-haiku-4.5",
      "owned_by": "anthropic",
      "api_surface": "chat_completions",
      "catalog_created_unix": 1770276853,
      "catalog_context_window": null,
      "catalog_max_output_tokens": 8192,
      "input_usd_per_million": null,
      "output_usd_per_million": null,
      "context_window": null,
      "max_output_tokens": null,
      "provider": null,
      "documented_capabilities": null
    },
    {
      "model_id": "anthropic-claude-opus-4.5",
      "owned_by": "anthropic",
      "api_surface": "chat_completions",
      "catalog_created_unix": 1764790378,
      "catalog_context_window": null,
      "catalog_max_output_tokens": 8192,
      "input_usd_per_million": null,
      "output_usd_per_million": null,
      "context_window": null,
      "max_output_tokens": null,
      "provider": null,
      "documented_capabilities": null
    },
    {
      "model_id": "anthropic-claude-opus-4.6",
      "owned_by": "anthropic",
      "api_surface": "chat_completions",
      "catalog_created_unix": 1770333973,
      "catalog_context_window": null,
      "catalog_max_output_tokens": 8192,
      "input_usd_per_million": null,
      "output_usd_per_million": null,
      "context_window": null,
      "max_output_tokens": null,
      "provider": null,
      "documented_capabilities": null
    },
    {
      "model_id": "anthropic-claude-opus-4.7",
      "owned_by": "anthropic",
      "api_surface": "chat_completions",
      "catalog_created_unix": 1776379334,
      "catalog_context_window": null,
      "catalog_max_output_tokens": 8192,
      "input_usd_per_million": null,
      "output_usd_per_million": null,
      "context_window": null,
      "max_output_tokens": null,
      "provider": null,
      "documented_capabilities": null
    },
    {
      "model_id": "anthropic-claude-opus-4.8",
      "owned_by": "anthropic",
      "api_surface": "chat_completions",
      "catalog_created_unix": 1780009573,
      "catalog_context_window": null,
      "catalog_max_output_tokens": 128000,
      "input_usd_per_million": null,
      "output_usd_per_million": null,
      "context_window": null,
      "max_output_tokens": null,
      "provider": null,
      "documented_capabilities": null
    },
    {
      "model_id": "anthropic-claude-opus-5",
      "owned_by": "anthropic",
      "api_surface": "chat_completions",
      "catalog_created_unix": 1784926741,
      "catalog_context_window": null,
      "catalog_max_output_tokens": 128000,
      "input_usd_per_million": null,
      "output_usd_per_million": null,
      "context_window": null,
      "max_output_tokens": null,
      "provider": null,
      "documented_capabilities": null
    },
    {
      "model_id": "arcee-trinity-large-thinking",
      "owned_by": "digitalocean",
      "api_surface": "chat_completions",
      "catalog_created_unix": 1775072224,
      "catalog_context_window": null,
      "catalog_max_output_tokens": 32000,
      "input_usd_per_million": "0.25",
      "output_usd_per_million": "0.90",
      "context_window": 128000,
      "max_output_tokens": 32000,
      "provider": "Arcee",
      "documented_capabilities": {
        "modalities": [
          "text"
        ],
        "prompt_caching": true,
        "tools": null,
        "structured_output": null,
        "reasoning": true
      }
    },
    {
      "model_id": "bge-m3",
      "owned_by": "digitalocean",
      "api_surface": "embeddings",
      "catalog_created_unix": 1774281224,
      "catalog_context_window": null,
      "catalog_max_output_tokens": null,
      "input_usd_per_million": null,
      "output_usd_per_million": null,
      "context_window": null,
      "max_output_tokens": null,
      "provider": null,
      "documented_capabilities": null
    },
    {
      "model_id": "bge-reranker-v2-m3",
      "owned_by": "digitalocean",
      "api_surface": "reranking",
      "catalog_created_unix": 1775636284,
      "catalog_context_window": null,
      "catalog_max_output_tokens": null,
      "input_usd_per_million": null,
      "output_usd_per_million": null,
      "context_window": null,
      "max_output_tokens": null,
      "provider": null,
      "documented_capabilities": null
    },
    {
      "model_id": "deepseek-3.2",
      "owned_by": "digitalocean",
      "api_surface": "chat_completions",
      "catalog_created_unix": 1776375302,
      "catalog_context_window": null,
      "catalog_max_output_tokens": 163840,
      "input_usd_per_million": null,
      "output_usd_per_million": null,
      "context_window": null,
      "max_output_tokens": null,
      "provider": null,
      "documented_capabilities": null
    },
    {
      "model_id": "deepseek-4-flash",
      "owned_by": "digitalocean",
      "api_surface": "chat_completions",
      "catalog_created_unix": 1779896095,
      "catalog_context_window": null,
      "catalog_max_output_tokens": 384000,
      "input_usd_per_million": null,
      "output_usd_per_million": null,
      "context_window": null,
      "max_output_tokens": null,
      "provider": null,
      "documented_capabilities": null
    },
    {
      "model_id": "deepseek-v4-flash-0731",
      "owned_by": "digitalocean",
      "api_surface": "chat_completions",
      "catalog_created_unix": 1786052860,
      "catalog_context_window": null,
      "catalog_max_output_tokens": 1048576,
      "input_usd_per_million": "0.080",
      "output_usd_per_million": "0.252",
      "context_window": 1048576,
      "max_output_tokens": 1048576,
      "provider": "DeepSeek",
      "documented_capabilities": {
        "modalities": [
          "text"
        ],
        "prompt_caching": true,
        "tools": null,
        "structured_output": null,
        "reasoning": true
      }
    },
    {
      "model_id": "deepseek-v4-pro",
      "owned_by": "digitalocean",
      "api_surface": "chat_completions",
      "catalog_created_unix": 1777633630,
      "catalog_context_window": null,